{
  "$schema": "./config.schema.json",
  "version": "1.0.0",
  
  "monitoring": {
    "subtaskTimeout": 600000,
    "taskChainTimeout": 900000,
    "stalledPendingThreshold": 1800000,
    "stalledRunningThreshold": 600000,
    "mainTaskTimeout": 3600000
  },
  
  "retry": {
    "maxRetries": 2,
    "checkInterval": 10000,
    "spawnTimeout": 300000,
    "backoffMultiplier": 2,
    "initialDelay": 60000
  },
  
  "progress": {
    "enabled": true,
    "reportInterval": 60000,
    "timeoutCheckInterval": 60000
  },
  
  "notification": {
    "channel": "wecom",
    "target": "wecom-agent:YangKe",
    "enabled": true,
    "throttle": 3000,
    "maxMessageLength": 200,
    "quietHours": {
      "enabled": false,
      "start": "23:00",
      "end": "07:00"
    },
    "types": {
      "subtaskSpawned": true,
      "subtaskCompleted": true,
      "subtaskFailed": true,
      "subtaskTimeout": true,
      "mainTaskCompleted": true,
      "taskChainTimeout": true,
      "stalledTask": true,
      "progress": true,
      "retry": true
    }
  },
  
  "storage": {
    "stateDir": "~/.openclaw/extensions/task-monitor/state",
    "tasksDir": "~/.openclaw/workspace/memory/tasks"
  },
  
  "logging": {
    "level": "info"
  }
}
